{
  "schema_version": 1,
  "topology": "rc_lowpass",
  "behavior": {
    "cutoff_hz": {
      "min": 1500.0,
      "max": 1700.0,
      "target": 1600.0
    },
    "passband_gain": {
      "min": 0.89,
      "max": 0.92
    }
  },
  "operating_conditions": {
    "source_resistance_ohm": 100.0,
    "load_resistance_ohm": 10000.0
  },
  "components": {
    "resistance_ohm": {
      "min": 1000.0,
      "max": 1000.0,
      "series": "E12"
    },
    "capacitance_f": {
      "min": 1e-7,
      "max": 1e-7,
      "series": "E12"
    }
  }
}
