{
  "schema_version": 1,
  "topology": "rc_lowpass",
  "behavior": {
    "cutoff_hz": {
      "min": 1300.0,
      "max": 1500.0,
      "target": 1500.0
    }
  },
  "components": {
    "resistance_ohm": {
      "min": 1000.0,
      "max": 1000.0,
      "series": "E12"
    },
    "capacitance_f": {
      "min": 1e-7,
      "max": 1.2e-7,
      "series": "E12"
    }
  }
}
